{
  "directed": false,
  "multigraph": false,
  "graph": {
    "pid_id": 14,
    "pid_name": "E12V01-VER.EX01",
    "source_file": "G:\\My Drive\\Git\\CoDesign\\data\\json\\E12V01-VER.EX01.json"
  },
  "nodes": [
    {
      "id": "eq_22",
      "db_id": 22,
      "label": "Equipment",
      "tag_name": "H1201",
      "class_name": "plateHeatExchanger.py",
      "tag_prefix": "H",
      "tag_sequence": "1201",
      "tag_suffix": "",
      "description": null,
      "pid_id": 14,
      "pid_name": "E12V01-VER.EX01"
    },
    {
      "id": "noz_56",
      "db_id": 56,
      "label": "Nozzle",
      "subtag": "N1",
      "nominal_diameter": "80",
      "nominal_pressure": null,
      "equipment_id": 22,
      "equipment_tag": "H1201",
      "equipment_class": "plateHeatExchanger.py",
      "pid_id": 14,
      "pid_name": "E12V01-VER.EX01"
    },
    {
      "id": "noz_57",
      "db_id": 57,
      "label": "Nozzle",
      "subtag": "N2",
      "nominal_diameter": "80",
      "nominal_pressure": null,
      "equipment_id": 22,
      "equipment_tag": "H1201",
      "equipment_class": "plateHeatExchanger.py",
      "pid_id": 14,
      "pid_name": "E12V01-VER.EX01"
    },
    {
      "id": "noz_58",
      "db_id": 58,
      "label": "Nozzle",
      "subtag": "N3",
      "nominal_diameter": "50",
      "nominal_pressure": null,
      "equipment_id": 22,
      "equipment_tag": "H1201",
      "equipment_class": "plateHeatExchanger.py",
      "pid_id": 14,
      "pid_name": "E12V01-VER.EX01"
    },
    {
      "id": "noz_59",
      "db_id": 59,
      "label": "Nozzle",
      "subtag": "N4",
      "nominal_diameter": "50",
      "nominal_pressure": null,
      "equipment_id": 22,
      "equipment_tag": "H1201",
      "equipment_class": "plateHeatExchanger.py",
      "pid_id": 14,
      "pid_name": "E12V01-VER.EX01"
    }
  ],
  "links": [
    {
      "type": "HAS_NOZZLE",
      "source": "eq_22",
      "target": "noz_56"
    },
    {
      "type": "HAS_NOZZLE",
      "source": "eq_22",
      "target": "noz_57"
    },
    {
      "type": "HAS_NOZZLE",
      "source": "eq_22",
      "target": "noz_58"
    },
    {
      "type": "HAS_NOZZLE",
      "source": "eq_22",
      "target": "noz_59"
    }
  ]
}