{
  "directed": false,
  "multigraph": false,
  "graph": {
    "pid_id": 33,
    "pid_name": "P02V01-VER.EX01",
    "source_file": "G:\\My Drive\\Git\\CoDesign\\data\\json\\P02V01-VER.EX01.json"
  },
  "nodes": [
    {
      "id": "eq_31",
      "db_id": 31,
      "label": "Equipment",
      "tag_name": "P4712",
      "class_name": "centrifugalPump.py",
      "tag_prefix": "P",
      "tag_sequence": "4712",
      "tag_suffix": null,
      "description": null,
      "pid_id": 33,
      "pid_name": "P02V01-VER.EX01"
    },
    {
      "id": "noz_67",
      "db_id": 67,
      "label": "Nozzle",
      "subtag": null,
      "nominal_diameter": "80",
      "nominal_pressure": null,
      "equipment_id": 31,
      "equipment_tag": "P4712",
      "equipment_class": "centrifugalPump.py",
      "pid_id": 33,
      "pid_name": "P02V01-VER.EX01"
    },
    {
      "id": "line_38",
      "db_id": 38,
      "label": "Line",
      "line_number": "48121",
      "fluid_code": "MNb",
      "nominal_diameter": "80",
      "piping_class_code": "75HB",
      "pid_id": 33,
      "pid_name": "P02V01-VER.EX01"
    }
  ],
  "links": [
    {
      "type": "HAS_NOZZLE",
      "source": "eq_31",
      "target": "noz_67"
    }
  ]
}