{
  "directed": false,
  "multigraph": false,
  "graph": {
    "pid_id": 6,
    "pid_name": "E03V01-VER.EX01",
    "source_file": "G:\\My Drive\\Git\\CoDesign\\data\\json\\E03V01-VER.EX01.json"
  },
  "nodes": [
    {
      "id": "eq_10",
      "db_id": 10,
      "label": "Equipment",
      "tag_name": "P-4713",
      "class_name": "centrifugalPump.py",
      "tag_prefix": "P",
      "tag_sequence": "4713",
      "tag_suffix": null,
      "description": null,
      "pid_id": 6,
      "pid_name": "E03V01-VER.EX01"
    },
    {
      "id": "noz_34",
      "db_id": 34,
      "label": "Nozzle",
      "subtag": "N-1",
      "nominal_diameter": null,
      "nominal_pressure": null,
      "equipment_id": 10,
      "equipment_tag": "P-4713",
      "equipment_class": "centrifugalPump.py",
      "pid_id": 6,
      "pid_name": "E03V01-VER.EX01"
    }
  ],
  "links": [
    {
      "type": "HAS_NOZZLE",
      "source": "eq_10",
      "target": "noz_34"
    }
  ]
}