{
  "directed": false,
  "multigraph": false,
  "graph": {
    "pid_id": 18,
    "pid_name": "I02V01-VER.EX01",
    "source_file": "G:\\My Drive\\Git\\CoDesign\\data\\json\\I02V01-VER.EX01.json"
  },
  "nodes": [
    {
      "id": "line_21",
      "db_id": 21,
      "label": "Line",
      "line_number": null,
      "fluid_code": null,
      "nominal_diameter": null,
      "piping_class_code": null,
      "pid_id": 18,
      "pid_name": "I02V01-VER.EX01"
    }
  ],
  "links": []
}