{
  "directed": false,
  "multigraph": false,
  "graph": {
    "pid_id": 9,
    "pid_name": "E06V01-VER.EX01",
    "source_file": "G:\\My Drive\\Git\\CoDesign\\data\\json\\E06V01-VER.EX01.json"
  },
  "nodes": [
    {
      "id": "eq_14",
      "db_id": 14,
      "label": "Equipment",
      "tag_name": "P-4713",
      "class_name": "centrifugalPump.py",
      "tag_prefix": "P",
      "tag_sequence": "4713",
      "tag_suffix": null,
      "description": null,
      "pid_id": 9,
      "pid_name": "E06V01-VER.EX01"
    },
    {
      "id": "eq_15",
      "db_id": 15,
      "label": "Equipment",
      "tag_name": "H-1009",
      "class_name": "plateHeatExchanger.py",
      "tag_prefix": "H",
      "tag_sequence": "1009",
      "tag_suffix": null,
      "description": null,
      "pid_id": 9,
      "pid_name": "E06V01-VER.EX01"
    },
    {
      "id": "noz_42",
      "db_id": 42,
      "label": "Nozzle",
      "subtag": "N-1",
      "nominal_diameter": null,
      "nominal_pressure": null,
      "equipment_id": 14,
      "equipment_tag": "P-4713",
      "equipment_class": "centrifugalPump.py",
      "pid_id": 9,
      "pid_name": "E06V01-VER.EX01"
    },
    {
      "id": "noz_43",
      "db_id": 43,
      "label": "Nozzle",
      "subtag": "N-2",
      "nominal_diameter": null,
      "nominal_pressure": null,
      "equipment_id": 14,
      "equipment_tag": "P-4713",
      "equipment_class": "centrifugalPump.py",
      "pid_id": 9,
      "pid_name": "E06V01-VER.EX01"
    },
    {
      "id": "noz_44",
      "db_id": 44,
      "label": "Nozzle",
      "subtag": "N-1",
      "nominal_diameter": null,
      "nominal_pressure": null,
      "equipment_id": 15,
      "equipment_tag": "H-1009",
      "equipment_class": "plateHeatExchanger.py",
      "pid_id": 9,
      "pid_name": "E06V01-VER.EX01"
    },
    {
      "id": "noz_45",
      "db_id": 45,
      "label": "Nozzle",
      "subtag": "N-2",
      "nominal_diameter": null,
      "nominal_pressure": null,
      "equipment_id": 15,
      "equipment_tag": "H-1009",
      "equipment_class": "plateHeatExchanger.py",
      "pid_id": 9,
      "pid_name": "E06V01-VER.EX01"
    },
    {
      "id": "noz_46",
      "db_id": 46,
      "label": "Nozzle",
      "subtag": "N-3",
      "nominal_diameter": null,
      "nominal_pressure": null,
      "equipment_id": 15,
      "equipment_tag": "H-1009",
      "equipment_class": "plateHeatExchanger.py",
      "pid_id": 9,
      "pid_name": "E06V01-VER.EX01"
    },
    {
      "id": "noz_47",
      "db_id": 47,
      "label": "Nozzle",
      "subtag": "N-4",
      "nominal_diameter": null,
      "nominal_pressure": null,
      "equipment_id": 15,
      "equipment_tag": "H-1009",
      "equipment_class": "plateHeatExchanger.py",
      "pid_id": 9,
      "pid_name": "E06V01-VER.EX01"
    },
    {
      "id": "line_19",
      "db_id": 19,
      "label": "Line",
      "line_number": "47132",
      "fluid_code": "MNb",
      "nominal_diameter": "80",
      "piping_class_code": "75HB13",
      "pid_id": 9,
      "pid_name": "E06V01-VER.EX01"
    }
  ],
  "links": [
    {
      "type": "HAS_NOZZLE",
      "source": "eq_14",
      "target": "noz_42"
    },
    {
      "type": "HAS_NOZZLE",
      "source": "eq_14",
      "target": "noz_43"
    },
    {
      "type": "HAS_NOZZLE",
      "source": "eq_15",
      "target": "noz_44"
    },
    {
      "type": "HAS_NOZZLE",
      "source": "eq_15",
      "target": "noz_45"
    },
    {
      "type": "HAS_NOZZLE",
      "source": "eq_15",
      "target": "noz_46"
    },
    {
      "type": "HAS_NOZZLE",
      "source": "eq_15",
      "target": "noz_47"
    },
    {
      "type": "CONNECTED_BY_LINE",
      "connection_id": 2,
      "line_id": 19,
      "line_number": "47132",
      "fluid_code": "MNb",
      "nominal_diameter": "80",
      "piping_class_code": "75HB13",
      "source": "noz_43",
      "target": "noz_44"
    },
    {
      "type": "LINE_TO_NOZZLE",
      "source": "noz_43",
      "target": "line_19"
    },
    {
      "type": "LINE_TO_NOZZLE",
      "source": "noz_44",
      "target": "line_19"
    }
  ]
}