{
  "directed": false,
  "multigraph": false,
  "graph": {
    "pid_id": 19,
    "pid_name": "I03V01-VER.EX01",
    "source_file": "G:\\My Drive\\Git\\CoDesign\\data\\json\\I03V01-VER.EX01.json"
  },
  "nodes": [
    {
      "id": "eq_26",
      "db_id": 26,
      "label": "Equipment",
      "tag_name": null,
      "class_name": "tank.py",
      "tag_prefix": null,
      "tag_sequence": null,
      "tag_suffix": null,
      "description": null,
      "pid_id": 19,
      "pid_name": "I03V01-VER.EX01"
    },
    {
      "id": "noz_61",
      "db_id": 61,
      "label": "Nozzle",
      "subtag": null,
      "nominal_diameter": null,
      "nominal_pressure": null,
      "equipment_id": 26,
      "equipment_tag": null,
      "equipment_class": "tank.py",
      "pid_id": 19,
      "pid_name": "I03V01-VER.EX01"
    },
    {
      "id": "line_22",
      "db_id": 22,
      "label": "Line",
      "line_number": null,
      "fluid_code": null,
      "nominal_diameter": null,
      "piping_class_code": null,
      "pid_id": 19,
      "pid_name": "I03V01-VER.EX01"
    },
    {
      "id": "line_23",
      "db_id": 23,
      "label": "Line",
      "line_number": null,
      "fluid_code": null,
      "nominal_diameter": null,
      "piping_class_code": null,
      "pid_id": 19,
      "pid_name": "I03V01-VER.EX01"
    }
  ],
  "links": [
    {
      "type": "HAS_NOZZLE",
      "source": "eq_26",
      "target": "noz_61"
    }
  ]
}