{
  "directed": false,
  "multigraph": false,
  "graph": {
    "pid_id": 16,
    "pid_name": "E14V01-VER.EX01",
    "source_file": "G:\\My Drive\\Git\\CoDesign\\data\\json\\E14V01-VER.EX01.json"
  },
  "nodes": [
    {
      "id": "eq_24",
      "db_id": 24,
      "label": "Equipment",
      "tag_name": "T1301",
      "class_name": "tank.py",
      "tag_prefix": null,
      "tag_sequence": null,
      "tag_suffix": null,
      "description": null,
      "pid_id": 16,
      "pid_name": "E14V01-VER.EX01"
    }
  ],
  "links": []
}