{
  "directed": false,
  "multigraph": false,
  "graph": {
    "pid_id": 13,
    "pid_name": "E11V01-VER.EX01",
    "source_file": "G:\\My Drive\\Git\\CoDesign\\data\\json\\E11V01-VER.EX01.json"
  },
  "nodes": [
    {
      "id": "eq_21",
      "db_id": 21,
      "label": "Equipment",
      "tag_name": "H1101",
      "class_name": "plateHeatExchanger.py",
      "tag_prefix": "H",
      "tag_sequence": "1101",
      "tag_suffix": "",
      "description": null,
      "pid_id": 13,
      "pid_name": "E11V01-VER.EX01"
    }
  ],
  "links": []
}