{
  "directed": false,
  "multigraph": false,
  "graph": {
    "pid_id": 32,
    "pid_name": "P01V01-VER.EX01",
    "source_file": "G:\\My Drive\\Git\\CoDesign\\data\\json\\P01V01-VER.EX01.json"
  },
  "nodes": [
    {
      "id": "eq_29",
      "db_id": 29,
      "label": "Equipment",
      "tag_name": "P4712",
      "class_name": "centrifugalPump.py",
      "tag_prefix": "P",
      "tag_sequence": "4712",
      "tag_suffix": null,
      "description": null,
      "pid_id": 32,
      "pid_name": "P01V01-VER.EX01"
    },
    {
      "id": "eq_30",
      "db_id": 30,
      "label": "Equipment",
      "tag_name": "H1008",
      "class_name": "plateHeatExchanger.py",
      "tag_prefix": "H",
      "tag_sequence": "1008",
      "tag_suffix": null,
      "description": null,
      "pid_id": 32,
      "pid_name": "P01V01-VER.EX01"
    },
    {
      "id": "noz_65",
      "db_id": 65,
      "label": "Nozzle",
      "subtag": null,
      "nominal_diameter": null,
      "nominal_pressure": null,
      "equipment_id": 29,
      "equipment_tag": "P4712",
      "equipment_class": "centrifugalPump.py",
      "pid_id": 32,
      "pid_name": "P01V01-VER.EX01"
    },
    {
      "id": "noz_66",
      "db_id": 66,
      "label": "Nozzle",
      "subtag": null,
      "nominal_diameter": null,
      "nominal_pressure": null,
      "equipment_id": 30,
      "equipment_tag": "H1008",
      "equipment_class": "plateHeatExchanger.py",
      "pid_id": 32,
      "pid_name": "P01V01-VER.EX01"
    },
    {
      "id": "line_37",
      "db_id": 37,
      "label": "Line",
      "line_number": "48122",
      "fluid_code": "M",
      "nominal_diameter": "80",
      "piping_class_code": "75HB",
      "pid_id": 32,
      "pid_name": "P01V01-VER.EX01"
    }
  ],
  "links": [
    {
      "type": "HAS_NOZZLE",
      "source": "eq_29",
      "target": "noz_65"
    },
    {
      "type": "HAS_NOZZLE",
      "source": "eq_30",
      "target": "noz_66"
    },
    {
      "type": "CONNECTED_BY_LINE",
      "connection_id": 3,
      "line_id": 37,
      "line_number": "48122",
      "fluid_code": "M",
      "nominal_diameter": "80",
      "piping_class_code": "75HB",
      "source": "noz_65",
      "target": "noz_66"
    },
    {
      "type": "LINE_TO_NOZZLE",
      "source": "noz_65",
      "target": "line_37"
    },
    {
      "type": "LINE_TO_NOZZLE",
      "source": "noz_66",
      "target": "line_37"
    }
  ]
}