{
  "directed": false,
  "multigraph": false,
  "graph": {
    "pid_id": 31,
    "pid_name": "I15V01-VER.EX01",
    "source_file": "G:\\My Drive\\Git\\CoDesign\\data\\json\\I15V01-VER.EX01.json"
  },
  "nodes": [
    {
      "id": "eq_28",
      "db_id": 28,
      "label": "Equipment",
      "tag_name": "V15",
      "class_name": "vessel.py",
      "tag_prefix": "V",
      "tag_sequence": "15",
      "tag_suffix": null,
      "description": null,
      "pid_id": 31,
      "pid_name": "I15V01-VER.EX01"
    },
    {
      "id": "noz_63",
      "db_id": 63,
      "label": "Nozzle",
      "subtag": "L1",
      "nominal_diameter": null,
      "nominal_pressure": null,
      "equipment_id": 28,
      "equipment_tag": "V15",
      "equipment_class": "vessel.py",
      "pid_id": 31,
      "pid_name": "I15V01-VER.EX01"
    },
    {
      "id": "noz_64",
      "db_id": 64,
      "label": "Nozzle",
      "subtag": "L2",
      "nominal_diameter": null,
      "nominal_pressure": null,
      "equipment_id": 28,
      "equipment_tag": "V15",
      "equipment_class": "vessel.py",
      "pid_id": 31,
      "pid_name": "I15V01-VER.EX01"
    }
  ],
  "links": [
    {
      "type": "HAS_NOZZLE",
      "source": "eq_28",
      "target": "noz_63"
    },
    {
      "type": "HAS_NOZZLE",
      "source": "eq_28",
      "target": "noz_64"
    }
  ]
}